id_alibi,message_suspect,id_witness1,message_confirm_witness1,message_unclear_witness1
DRINKING,I was drinking at the bar.,BARTENDER,Yeah| they were here all night. Vulgar as ever.,They are a regular but| I haven't seen them for weeks.
GAMBLING,I was gambling with some buddies.,FRIEND,Yeah| they were there but| keep that under your hat.,They never showed up. Said they had a way to make REAL money.
DINNER_AT_HOME,I was at home having dinner with my family.,SPOUSE,We had dinner and called it a night. Nothing Exciting... never is...,No| and I'm not gonna to lie for them anymore!
WORKING_LATE,I had to work at the lab pretty late that night.,DESK_SECURITY,Yup| here's their sign in log for that day. Here all night...,Let's see... they signed in... 9AM but| never signed out. That's weird.
WONT_SAY,None of your business!  But| I was headed to midtown.,TRAFFIC_CAM,(Camera shows their car at the time witness said),(Camera shows suspect going the opposite direction towards the crime scene.)